{
  "provenance": "first-party",
  "runsOn": {
    "location": "cloud",
    "provider": "Cloudflare",
    "platform": "Durable Objects"
  },
  "summary": "Short-lived index from a pairing code to its account, plus pairing rate limiting.",
  "footprint": {
    "paths": [
      "packages/axo-api-worker/src/auth/pairing-directory.ts"
    ],
    "files": 1,
    "lines": 123
  },
  "anchors": [
    "packages/axo-api-worker/src/auth/pairing-directory.ts"
  ]
}
