{
  "provenance": "third-party",
  "runsOn": {
    "location": "local",
    "platform": "Node.js, in an axod PTY"
  },
  "summary": "The Pi agent CLI, an external program axod runs interactively in a PTY. Sole writer of its JSONL conversation file.",
  "anchors": [
    "crates/axo-pi/src/launch.rs",
    "crates/axo-pi/src/lock.rs"
  ]
}
