{
  "provenance": "first-party",
  "runsOn": {
    "location": "cloud",
    "provider": "Cloudflare",
    "platform": "Durable Objects"
  },
  "summary": "AxoAccountManager Durable Object, one per Axo account. Owns web sessions, pairings, host memberships and credential verifiers, and hosts the relay sockets for that account's hosts and clients.",
  "footprint": {
    "paths": [
      "packages/axo-api-worker/src/auth/account-manager.ts",
      "packages/axo-api-worker/src/axo-host-relay.ts",
      "packages/axo-api-worker/src/relay"
    ],
    "files": 5,
    "lines": 1597
  },
  "anchors": [
    "packages/axo-api-worker/src/auth/account-manager.ts",
    "packages/axo-api-worker/src/axo-host-relay.ts"
  ]
}
