{
  "provenance": "first-party",
  "runsOn": {
    "location": "browser",
    "platform": "served by the Worker"
  },
  "summary": "Browser Workbench at /app. Lists hosts and sessions, drives remote terminals and shows Pi history.",
  "footprint": {
    "paths": [
      "packages/axo-web-app",
      "packages/axo-app"
    ],
    "files": 19,
    "lines": 4683
  },
  "anchors": [
    "packages/axo-web-app/src/remote-terminal-app.tsx",
    "packages/axo-web-app/src/pi-history-pane.tsx"
  ]
}
