{
  "provenance": "first-party",
  "runsOn": {
    "location": "local",
    "platform": "Node.js"
  },
  "summary": "The @feynman/model library loads and writes per-element JSON models, validates schemas and references, computes bootstrap/update coverage from Git, measures source metadata and footprints, and builds a compact index.",
  "footprint": {
    "paths": [
      "packages/model/"
    ],
    "files": 21,
    "lines": 1505
  },
  "anchors": [
    "packages/model/src/model.mjs",
    "packages/model/src/check.mjs",
    "packages/model/src/coverage.mjs",
    "packages/model/src/measure.mjs",
    "packages/model/src/index-model.mjs",
    "packages/model/src/index.mjs",
    "packages/model/src/git.mjs",
    "packages/model/schema/",
    "packages/model/package.json",
    "packages/model/src/index.d.ts"
  ]
}
