{
  "provenance": "first-party",
  "runsOn": {
    "location": "cloud",
    "provider": "Cloudflare",
    "platform": "Workers"
  },
  "summary": "Cloudflare Worker at axo.leostera.dev/api. OAuth sign-in, host pairing, and the relay between browser clients and linked hosts.",
  "footprint": {
    "paths": [
      "packages/axo-api-worker/src/http",
      "packages/axo-api-worker/src/index.ts",
      "packages/axo-api-worker/src/access.ts",
      "packages/axo-api-worker/src/observability.ts",
      "packages/axo-api-worker/src/axo-host-directory.ts",
      "packages/axo-api-worker/src/auth/cloudflare.ts",
      "packages/axo-api-worker/src/auth/provider.ts",
      "packages/axo-api-worker/src/auth/crypto.ts",
      "packages/axo-api-worker/src/auth/pairing.ts",
      "packages/axo-api-worker/tests",
      "packages/axo-api-worker/testing",
      "packages/axo-api-worker/scripts",
      "packages/axo-api",
      "schemas",
      "sites"
    ],
    "files": 105,
    "lines": 13867
  },
  "anchors": [
    "packages/axo-api-worker/src/http/router.ts",
    "packages/axo-api-worker/src/index.ts"
  ]
}
