{
  "provenance": "first-party",
  "runsOn": {
    "location": "local",
    "platform": "Pi coding-agent extension host"
  },
  "summary": "The pi-feynman extension adapts modeler operations into Pi tools and slash commands, reconstructs extraction state/read evidence from the session branch, blocks direct coverage-ledger writes, and optionally renders the current model.",
  "footprint": {
    "paths": [
      "packages/pi-feynman/"
    ],
    "files": 5,
    "lines": 531
  },
  "anchors": [
    "packages/pi-feynman/src/index.ts",
    "packages/pi-feynman/package.json"
  ]
}
